{
  "npcs": [
    {
      "id": "NP00003000",
      "name": "Merris Copperpot",
      "race": "Halfling",
      "sex": "Female",
      "type": "citizen",
      "eye_color": "Brown",
      "hair_color": "Chestnut",
      "build": "Plump",
      "skin_tone": "Rosy",
      "hair_length": "Medium",
      "hair_style": "Straight",
      "height": "Medium",
      "skin_texture": "Smooth",
      "features": [],
      "description": "She is witty, charming, quick on the turn. She has brown eyes · medium straight chestnut hair · medium height and a plump build · rosy smooth skin. Plump halfling innkeeper with rosy cheeks and a laugh like clattering pans. Flour-dusted aprons, copper-pot charms on a kitchen-string, quick hands that shoo drunks and plate pies with equal force. Halfling hospitality made muscle: she remembers everyone’s favorite stew and everyone’s worst decision. She has . She wears layered travel-wear, weathered cloak, belt pouches, sturdy boots. She wears bare-chested under a fur mantle, beadwork cords and bronze bangles, defiant and theatrical."
    },
    {
      "id": "NP00003001",
      "name": "Tharic Coalbrow",
      "race": "Ember Dwarf",
      "sex": "Male",
      "type": "citizen",
      "eye_color": "Gray",
      "hair_color": "Black streaked with soot",
      "build": "Bulky",
      "skin_tone": "Soot-browned",
      "hair_length": "Short",
      "hair_style": "Braided",
      "height": "Medium",
      "skin_texture": "Rough",
      "features": [],
      "description": "He is witty, charming, quick on the turn. Soot-browned rough skin and gray eyes frame his face; short braided black streaked with soot hair. He has short, braided, black streaked with soot hair — gray eyes — soot-browned, rough skin — medium height, bulky build. Stocky forge-smith, beard sparking with ember-red beads. Laugh is short — advice is shorter. Ember Dwarf habits: heat-tempered leathers, ash-scented beard oil, prayers muttered into the quench. He has . She wears heat-tempered leathers, copper-riveted apron, rune-stitched cuffs. He wears boiled-leather jack with inset rune-plates, fingerless gloves and a many-pocketed tool harness."
    },
    {
      "id": "NP00003002",
      "name": "Elira Dawnmere",
      "race": "Human",
      "sex": "Female",
      "type": "citizen",
      "eye_color": "Blue",
      "hair_color": "Blonde",
      "build": "Slim",
      "skin_tone": "Fair",
      "hair_length": "Medium",
      "hair_style": "Straight",
      "height": "Medium",
      "skin_texture": "Smooth",
      "features": [],
      "description": "Fair smooth skin and blue eyes frame her face; medium straight blonde hair. Pale dresses, pale thread, blue eyes bright with careful dreams. She has medium, straight, blonde hair; blue eyes; fair, smooth skin; medium height, slim build. She is composed, purposeful, sharp when it counts. She hides tiny protective stitches in hems—quiet blessings paid forward one garment at a time. She has . She wears layered travel-wear, weathered cloak, belt pouches, sturdy boots. She wears sailor’s stripes beneath an oilskin, corded belt and hook-knife, tar-stained boots."
    },
    {
      "id": "NP00003003",
      "name": "Osric Harthollow",
      "race": "Human",
      "sex": "Male",
      "type": "citizen",
      "eye_color": "Brown",
      "hair_color": "Balding",
      "build": "Round",
      "skin_tone": "Light",
      "hair_length": "Medium",
      "hair_style": "Straight",
      "height": "Medium",
      "skin_texture": "Smooth",
      "features": [],
      "description": "He is composed, purposeful, sharp when it counts. He is of medium height and a round build — medium straight balding hair, brown eyes, light smooth skin. Round-bellied miller with a booming hello and flour-dusted boots. Smells faintly of grain and river mist. His stories have been told so often he’ve learned to walk on his own—and buy him ale when he do. He has . She wears layered travel-wear, weathered cloak, belt pouches, sturdy boots. He wears sailor’s stripes beneath an oilskin, corded belt and hook-knife, tar-stained boots."
    },
    {
      "id": "NP00003004",
      "name": "Kaelen Veyra",
      "race": "Great Elf",
      "sex": "Male",
      "type": "citizen",
      "eye_color": "Emerald",
      "hair_color": "Silver",
      "build": "Slim",
      "skin_tone": "Pale",
      "hair_length": "Medium",
      "hair_style": "Straight",
      "height": "Medium",
      "skin_texture": "Smooth",
      "features": [
        "pointed ears"
      ],
      "description": "He is composed, purposeful, sharp when it counts. He has medium straight silver hair · emerald eyes · medium height and a slim build · pale smooth skin. Great Elf manner: elegant diction, careful posture, and wit that bows before it cuts. He has medium, straight, silver hair; emerald eyes; pale, smooth skin; medium height, slim build. He has pointed ears. Layered robes ink-kissed at the cuffs. She wears high court robes with metallic trim, jeweled clasps, silk gloves, polished boots. He wears a flowing saffron robe belted with braided cord, soft doeskin shoes and a travel-cloak pinned with a moon-brooch."
    },
    {
      "id": "NP00003005",
      "name": "Branna Holloway",
      "race": "Human",
      "sex": "Female",
      "type": "citizen",
      "eye_color": "Hazel",
      "hair_color": "Red",
      "build": "Bulky",
      "skin_tone": "Tanned",
      "hair_length": "Medium",
      "hair_style": "Straight",
      "height": "Medium",
      "skin_texture": "Smooth",
      "features": [],
      "description": "Tanned smooth skin and hazel eyes frame her face; medium straight red hair. She has medium, straight, red hair; hazel eyes; tanned, smooth skin; medium height, bulky build. She is witty, charming, quick on the turn. Roughspun linen patched a dozen times; calluses you could read a field by. She laughs loud, trusts slow, and plants stubborn—each season an argument she intends to win. She has . She wears layered travel-wear, weathered cloak, belt pouches, sturdy boots. She wears a travel-worn cloak over layered leathers, hood up and boots dusted from the road."
    },
    {
      "id": "NP00003006",
      "name": "Liora Fenvale",
      "race": "Half–Forest Elf",
      "sex": "Female",
      "type": "citizen",
      "eye_color": "Violet",
      "hair_color": "Brown",
      "build": "Slim",
      "skin_tone": "Olive",
      "hair_length": "Medium",
      "hair_style": "Straight",
      "height": "Medium",
      "skin_texture": "Smooth",
      "features": [],
      "description": "With medium straight brown hair and violet eyes and olive smooth skin, she stands at medium height with slim build. She has medium, straight, brown hair; violet eyes; olive, smooth skin; medium height, slim build. She is calm, observant, quietly determined. Patchwork skirts perfumed by sage and resin. Human warmth, Forest Elf patience: she soothes with tea, warns with nettle, and writes your name on a leaf if you’ve crossed her. She has . She wears layered travel-wear, weathered cloak, belt pouches, sturdy boots. She wears layered green leathers over a linen tunic, a quiver high on the back, bracers etched with vinework."
    },
    {
      "id": "NP00003007",
      "name": "Torven Blacktusk",
      "race": "Ashfoot Orc",
      "sex": "Male",
      "type": "citizen",
      "eye_color": "Amber",
      "hair_color": "Black",
      "build": "Burly",
      "skin_tone": "Charcoal-green",
      "hair_length": "Medium",
      "hair_style": "Straight",
      "height": "Medium",
      "skin_texture": "Smooth",
      "features": [
        "tusks"
      ],
      "description": "He is calm, observant, quietly determined. All charcoal-green smooth skin and amber eyes, he carries a burly build at medium height; medium straight black hair. He has medium, straight, black hair — amber eyes — charcoal-green, smooth skin — medium height, burly build. Burly butcher with chipped tusks and an apron that’s seen storms. Ashfoot Orc roots: volcanic prayer-runes burned faint on his knuckles, smoke-salt on the tongue, steady as cooled stone. He has tusks. She wears obsidian-inset armor, ash-dyed wraps, bone totems, bare feet. He wears thick boiled-leather with bone rivets, heavy bracers and greaves scarred from raids."
    },
    {
      "id": "NP00003008",
      "name": "Sera Quickstep",
      "race": "Halfling",
      "sex": "Female",
      "type": "citizen",
      "eye_color": "Green",
      "hair_color": "Honey-brown",
      "build": "Compact",
      "skin_tone": "Warm",
      "hair_length": "Short",
      "hair_style": "Wavy",
      "height": "Short",
      "skin_texture": "Smooth",
      "features": [],
      "description": "She is composed, purposeful, sharp when it counts. She has warm smooth skin, green eyes, short wavy honey-brown hair, short height and a compact build. Market-runner who knows every shortcut and every price. Honey-brown curls, ink-smudged ledger, a grin that sells out stalls. She can weave through a crowd without touching a sleeve—unless it’s to lift your spirits. She has . She wears layered travel-wear, weathered cloak, belt pouches, sturdy boots. She wears a doublet and riding breeches with knee boots, gloves tucked through the belt."
    },
    {
      "id": "NP00003009",
      "name": "Dren Stonebinder",
      "race": "Hill Dwarf",
      "sex": "Male",
      "type": "citizen",
      "eye_color": "Hazel",
      "hair_color": "Sandy",
      "build": "Sturdy",
      "skin_tone": "Sun-browned",
      "hair_length": "Medium",
      "hair_style": "Straight",
      "height": "Medium",
      "skin_texture": "Rough",
      "features": [],
      "description": "He is composed, purposeful, sharp when it counts. He is of medium height and a sturdy build — medium straight sandy hair · hazel eyes · sun-browned rough skin. He has medium, straight, sandy hair — hazel eyes — sun-browned, rough skin — medium height, sturdy build. Mason who hums to mortar. Hill Dwarf habit: a pocket for chalk, a pocket for bread, and a pocket for promises. He has . She wears embroidered work tunic, stout belt, canvas trousers, field boots. He wears simple pilgrim’s wraps and sandals, walking staff banded in tin instead of a warhammer."
    },
    {
      "id": "NP00003010",
      "name": "Maera Snowtress",
      "race": "Snow Elf",
      "sex": "Female",
      "type": "citizen",
      "eye_color": "Ice-blue",
      "hair_color": "White",
      "build": "Slim",
      "skin_tone": "Pale with frost freckles",
      "hair_length": "Medium",
      "hair_style": "Braided",
      "height": "Medium",
      "skin_texture": "Smooth",
      "features": [
        "pointed ears"
      ],
      "description": "She is calm, observant, quietly determined. Maera has ice-blue eyes, medium braided white hair, medium height and a slim build, pale with frost freckles smooth skin. She has pointed ears. Iceseller who never slips. White braid, ice-blue gaze, coats lined in hare-fur. Snow Elf poise: cool courtesy, warmer prices if you bring news from mountain passes. She wears fur-lined coats, frost-woven wraps, high boots, glacier-gleam brooch. She wears layered green leathers over a linen tunic, a quiver high on the back, bracers etched with vinework."
    },
    {
      "id": "NP00003011",
      "name": "Keth Ironline",
      "race": "Iron Dwarf",
      "sex": "Male",
      "type": "citizen",
      "eye_color": "Brown",
      "hair_color": "Black",
      "build": "Bulky",
      "skin_tone": "Ruddy",
      "hair_length": "Medium",
      "hair_style": "Straight",
      "height": "Medium",
      "skin_texture": "Rough",
      "features": [],
      "description": "Of medium height and a bulky build, he shows brown eyes, medium straight black hair, ruddy rough skin. He is composed, purposeful, sharp when it counts. Railwright with arms like joists. Keeps the town’s winches honest and its cranes fed. Drinks water at work, ale at dusk, and respect at the same table as anyone who’ll give it. He has . She wears forge leathers, iron-banded bracers, tool belt, hobnail boots. He wears simple pilgrim’s wraps and sandals, walking staff banded in tin instead of a warhammer."
    },
    {
      "id": "NP00003012",
      "name": "Ysil Darkstring",
      "race": "Dark Elf",
      "sex": "Female",
      "type": "citizen",
      "eye_color": "Crimson",
      "hair_color": "White",
      "build": "Slim",
      "skin_tone": "Obsidian",
      "hair_length": "Medium",
      "hair_style": "Straight",
      "height": "Medium",
      "skin_texture": "Smooth",
      "features": [
        "pointed ears"
      ],
      "description": "All obsidian smooth skin and crimson eyes, she carries a slim build at medium height; medium straight white hair. She has medium, straight, white hair; crimson eyes; obsidian, smooth skin; medium height, slim build. She has pointed ears. She is composed, purposeful, sharp when it counts. Dark Elf craft turned to music: her instruments hold night in her soundbox and streetlight in her varnish. She wears shadow-cut leathers, web-lace sleeves, soft-soled boots, poisoners' kit. She wears mirror-bright steel plate with leaf-engraved pauldrons, chain underlayers and a scarlet tabard—weighty and martial."
    },
    {
      "id": "NP00003013",
      "name": "Vel Thornhook",
      "race": "Voided Tiefling",
      "sex": "Male",
      "type": "citizen",
      "eye_color": "Violet",
      "hair_color": "White",
      "build": "Slim",
      "skin_tone": "Pitch Black",
      "hair_length": "Medium",
      "hair_style": "Straight",
      "height": "Tall",
      "skin_texture": "Smooth",
      "features": [
        "horns",
        "tail",
        "pointed ears"
      ],
      "description": "All pitch black smooth skin and violet eyes, he carries a slim build at tall height; medium straight white hair. He has medium, straight, black hair; violet eyes; pale with violet undertone, smooth skin; medium height, slim build. He has black long straight smooth upward pointed horns, pitch black long smooth tail, pointed very long pointed ears. His heritage is obvious: pitch-black smooth skin, black long straight smooth upward pointed horns set upward, very long pointed very long pointed ears, pitch black long smooth tail. He wears a stark white linen wrap that throws his pitch-black skin into contrast, barefoot and jewel-bright rings. He is composed, purposeful, sharp when it counts. Dock-clerk whose ledgers never lose a page. He wears a high-collar robe and sleeveless outer cloak, a long sash belt with hanging charms, silver-stitched gloves, fitted trousers and heeled boots, a cloak patterned like stars.. The sea brings him secrets; he files him next to tariffs and lets him gather interest. She wears high-collar robe, sleeveless outer cloak, long sash belt, silver-stitched gloves, fitted trousers, heeled boots, cloak patterned like stars."
    },
    {
      "id": "NP00003014",
      "name": "Rook Tinsprocket",
      "race": "Goblin",
      "sex": "Male",
      "type": "citizen",
      "eye_color": "Amber",
      "hair_color": "Soot tuft",
      "build": "Wirey",
      "skin_tone": "Green",
      "hair_length": "Medium",
      "hair_style": "Straight",
      "height": "Medium",
      "skin_texture": "Smooth",
      "features": [],
      "description": "Rook has amber eyes; medium height and a wirey build; medium straight soot tuft hair; green smooth skin. He is composed, purposeful, sharp when it counts. Tinker with a satchel that ticks. Teeth like a grin of nails, goggles that make the world a polite blur. He charges extra for inventions that don’t explode and double for ones that do on command. He has . She wears layered travel-wear, weathered cloak, belt pouches, sturdy boots. He wears bare-chested under a fur mantle, beadwork cords and bronze bangles, defiant and theatrical."
    },
    {
      "id": "NP00003015",
      "name": "Anwen Reedwhistle",
      "race": "Avianfolk",
      "sex": "Female",
      "type": "citizen",
      "eye_color": "Silver",
      "hair_color": "Feather crest",
      "build": "Light",
      "skin_tone": "Pale",
      "hair_length": "Medium",
      "hair_style": "Straight",
      "height": "Medium",
      "skin_texture": "Smooth",
      "features": [
        "wings",
        "talons"
      ],
      "description": "She is composed, purposeful, sharp when it counts. She has pale smooth skin · silver eyes · medium straight feather crest hair · medium height and a light build. She has medium, straight, feather crest hair; silver eyes; pale, smooth skin; medium height, light build. Courier who times her landings to the bell. She writes letters in the air with her finger to remember her later. She has wings, talons. She wears feathered mantle, flight leathers, beadwork, talon guards. She wears steel plate over mail with a faded tabard, leather gloves and a sword belt worn smooth."
    },
    {
      "id": "NP00003016",
      "name": "Brother Malric",
      "race": "Human",
      "sex": "Male",
      "type": "citizen",
      "eye_color": "Gray",
      "hair_color": "Brown tonsure",
      "build": "Spare",
      "skin_tone": "Pale",
      "hair_length": "Medium",
      "hair_style": "Straight",
      "height": "Medium",
      "skin_texture": "Smooth",
      "features": [],
      "description": "He is composed, purposeful, sharp when it counts. He is of medium height and a spare build — medium straight brown tonsure hair, gray eyes, pale smooth skin. Archivist-priest with ink on his cuffs and patience for difficult truths. He lends books and collects apologies. His sermons are footnotes with teeth. He has . She wears layered travel-wear, weathered cloak, belt pouches, sturdy boots. He wears steel plate over mail with a faded tabard, leather gloves and a sword belt worn smooth."
    },
    {
      "id": "NP00003017",
      "name": "Garna Wavecut",
      "race": "Sharkkin",
      "sex": "Female",
      "type": "citizen",
      "eye_color": "Steel",
      "hair_color": "None",
      "build": "Bulky",
      "skin_tone": "Slate with pale bands",
      "hair_length": "Medium",
      "hair_style": "Straight",
      "height": "Medium",
      "skin_texture": "Smooth",
      "features": [],
      "description": "Of medium height and a bulky build, she shows steel eyes, medium straight none hair, slate with pale bands smooth skin. She is calm, observant, quietly determined. Fishmonger with a fillet knife that flashes like a gull. Slate hide, steel stare, voice calm as deep water. She salts gossip the way she salts catch—lightly, to keep it useful. She has . She wears layered travel-wear, weathered cloak, belt pouches, sturdy boots. She wears a doublet and riding breeches with knee boots, gloves tucked through the belt."
    },
    {
      "id": "NP00003018",
      "name": "Pellan Softroot",
      "race": "Myconid",
      "sex": "Male",
      "type": "citizen",
      "eye_color": "Teal bioluminescence",
      "hair_color": "Fruiting cap",
      "build": "Round",
      "skin_tone": "Mottled beige",
      "hair_length": "Medium",
      "hair_style": "Straight",
      "height": "Medium",
      "skin_texture": "Rough",
      "features": [
        "spores",
        "cap"
      ],
      "description": "He is calm, observant, quietly determined. All mottled beige rough skin and teal bioluminescence eyes, he carries a round build at medium height; medium straight fruiting cap hair. Porter who never hurries and never drops a thing. Soft-glow spores drift when he laughs. He remembers which crates sing to each other when stacked. He has spores, cap. She wears woven hyphae wraps, spore-pouch sash, soft sandals. He wears sailor’s stripes beneath an oilskin, corded belt and hook-knife, tar-stained boots."
    },
    {
      "id": "NP00003019",
      "name": "Ilwen Grayglass",
      "race": "Great Elf",
      "sex": "Female",
      "type": "citizen",
      "eye_color": "Grey",
      "hair_color": "Ash",
      "build": "Tall",
      "skin_tone": "Pale",
      "hair_length": "Medium",
      "hair_style": "Straight",
      "height": "Tall",
      "skin_texture": "Smooth",
      "features": [
        "pointed ears"
      ],
      "description": "She is composed, purposeful, sharp when it counts. She is of tall height and a tall build — medium straight ash hair · grey eyes · pale smooth skin. She has medium, straight, ash hair — grey eyes — pale, smooth skin — tall height, tall build. She has pointed ears. Glazier whose windows keep more than wind out. Prices rise with your rudeness — fall if you notice the beveling. She wears high court robes with metallic trim, jeweled clasps, silk gloves, polished boots. She wears supple leaf-dyed leathers with bark-plate reinforcements, a hood drawn low and soft boots for silent steps."
    },
    {
      "id": "NP00003020",
      "name": "Bera Copperbloom",
      "race": "Coastal Dwarf",
      "sex": "Female",
      "type": "citizen",
      "eye_color": "Sea-green",
      "hair_color": "Copper",
      "build": "Sturdy",
      "skin_tone": "Wind-browned",
      "hair_length": "Medium",
      "hair_style": "Braided",
      "height": "Medium",
      "skin_texture": "Rough",
      "features": [],
      "description": "She is calm, observant, quietly determined. Bera wears medium braided copper hair with sea-green eyes; wind-browned rough skin and medium height and a sturdy build complete the impression. Netmaker with sea-salt in her beard beads and a gull that refuses to leave. Coastal Dwarf craft: tarred twine, shell charms, swearing gentle enough for children—unless the knots tangle. She has . She wears tarred twine vest, sea-cloak, shell-braided beard, deck boots. She wears silk robes trimmed in gilt thread, beadwork at the hems and soft slippers that whisper over stone."
    },
    {
      "id": "NP00003021",
      "name": "Sorcha Lambkin",
      "race": "Caprine",
      "sex": "Female",
      "type": "citizen",
      "eye_color": "Amber",
      "hair_color": "Curled mane",
      "build": "Slim",
      "skin_tone": "Fawn",
      "hair_length": "Long",
      "hair_style": "Straight",
      "height": "Medium",
      "skin_texture": "Smooth",
      "features": [],
      "description": "She is composed, purposeful, sharp when it counts. All fawn smooth skin and amber eyes, she carries a slim build at medium height; long straight curled mane hair. She has long, straight, curled mane hair; amber eyes; fawn, smooth skin; medium height, slim build. Goatherd who names every bell and every storm. She has . She wears layered travel-wear, weathered cloak, belt pouches, sturdy boots. She wears linen shirt and waistcoat under a stormcloak, high boots and a brace of knives at the small of the back."
    },
    {
      "id": "NP00003022",
      "name": "Harrek Stonebloom",
      "race": "Goliath",
      "sex": "Male",
      "type": "citizen",
      "eye_color": "Brown",
      "hair_color": "Shaved",
      "build": "Bulky",
      "skin_tone": "Stone-marked",
      "hair_length": "Medium",
      "hair_style": "Straight",
      "height": "Very tall",
      "skin_texture": "Smooth",
      "features": [],
      "description": "He is witty, charming, quick on the turn. He is of very tall height and a bulky build — medium straight shaved hair · brown eyes · stone-marked smooth skin. He has medium, straight, shaved hair; brown eyes; stone-marked, smooth skin; very tall height, bulky build. Mason’s apprentice who lifts lintels alone. He blushes easily—a mountain with a sunrise caught in it. He has . She wears stone-dyed leathers, corded cloak, bone clasps, heavy sandals. He wears sheer gauze layers with metallic cords and rings, more pageant than practicality."
    },
    {
      "id": "NP00003023",
      "name": "Tess Vervain",
      "race": "Sableheart Tiefling",
      "sex": "Female",
      "type": "citizen",
      "eye_color": "Amethyst",
      "hair_color": "Purple",
      "build": "Curvy",
      "skin_tone": "Light Purple",
      "hair_length": "Medium",
      "hair_style": "Straight",
      "height": "Medium",
      "skin_texture": "Smooth",
      "features": [
        "horns",
        "tail",
        "pointed ears"
      ],
      "description": "She is composed, purposeful, sharp when it counts. Tess has light purple smooth skin · medium straight purple hair · amethyst eyes · medium height and a curvy build. She has medium, straight, black hair — amethyst eyes — deep brown with violet undertone, smooth skin — medium height, curvy build. She has polished gold silver bronze long curved pointed horns, long tail matching skin color, pointed ears. Her heritage is obvious: light purple or light blue glossy skin, polished gold silver bronze long curved pointed horns, long tail matching skin color matching the skin tone. Perfumer whose shop smells like secrets. She wears a laced corset bodice and a layered skirt with a high slit, long silk gloves, a bolero jacket with long sleeves, strapped heeled boots and jewelry chains.. She sells a scent for bravery and a cheaper one for pretending. She wears corset bodice with laced front, layered skirt with high slit, long silk gloves, bolero jacket, strapped heeled boots, jewelry chains and earrings. She wears a fitted satin dress with metallic piping and opera-length gloves, anklets chiming softly."
    },
    {
      "id": "NP00003024",
      "name": "Merrit Brightspool",
      "race": "Sylvari",
      "sex": "Male",
      "type": "citizen",
      "eye_color": "Leaf-green",
      "hair_color": "Vine-twist",
      "build": "Slim",
      "skin_tone": "Bark-olive",
      "hair_length": "Medium",
      "hair_style": "Straight",
      "height": "Medium",
      "skin_texture": "Smooth",
      "features": [],
      "description": "He is calm, observant, quietly determined. Merrit has leaf-green eyes · bark-olive smooth skin · medium height and a slim build · medium straight vine-twist hair. He has medium, straight, vine-twist hair — leaf-green eyes — bark-olive, smooth skin — medium height, slim build. Florist who ties bouquets like binding spells. His shop is a quiet duel between sunlight and shadow. He has . She wears layered travel-wear, weathered cloak, belt pouches, sturdy boots. He wears a travel-worn cloak over layered leathers, hood up and boots dusted from the road."
    },
    {
      "id": "NP00003025",
      "name": "Grish Stormpan",
      "race": "Storm Orc",
      "sex": "Male",
      "type": "citizen",
      "eye_color": "Ice-blue",
      "hair_color": "Black knot",
      "build": "Bulky",
      "skin_tone": "Sea-green",
      "hair_length": "Medium",
      "hair_style": "Straight",
      "height": "Medium",
      "skin_texture": "Smooth",
      "features": [
        "tusks"
      ],
      "description": "All sea-green smooth skin and ice-blue eyes, he carries a bulky build at medium height; medium straight black knot hair. He has medium, straight, black knot hair; ice-blue eyes; sea-green, smooth skin; medium height, bulky build. He is calm, observant, quietly determined. Street-cook who slaps batter like a drum. Pancakes flip to the beat of rain on canvas; his salt is measured with two fingers and a blessing. He has tusks. She wears storm-marked mail, sea-cloak, rope belt, boarder's boots. He wears brutal hide cuirass with iron rings, rawhide straps and a wolf-pelt mantle."
    },
    {
      "id": "NP00003026",
      "name": "Fennel Glowcap",
      "race": "Myconid",
      "sex": "Female",
      "type": "citizen",
      "eye_color": "Soft teal glow",
      "hair_color": "Fruiting cap",
      "build": "Small",
      "skin_tone": "Beige mottled with moss",
      "hair_length": "Long",
      "hair_style": "Straight",
      "height": "Short",
      "skin_texture": "Rough",
      "features": [
        "spores",
        "cap"
      ],
      "description": "She is composed, purposeful, sharp when it counts. All beige mottled with moss rough skin and soft teal glow eyes, she carries a small build at short height; long straight fruiting cap hair. Beekeeper who hums alongside her hives — spores drift gently when she works. Her honey is luminous at night, sold in clay pots shaped like lanterns. Myconid patience makes her voice slow, measured, soothing as beeswax smoke. She has spores, cap. She wears woven hyphae wraps, spore-pouch sash, soft sandals. She wears padded jack with steel splints under a quilted surcoat, knotted scarf and fingerless gloves."
    },
    {
      "id": "NP00003027",
      "name": "Rilven Ashmark",
      "race": "Snow Elf",
      "sex": "Male",
      "type": "citizen",
      "eye_color": "Ice-blue",
      "hair_color": "Silver",
      "build": "Slim",
      "skin_tone": "Pale with frost freckles",
      "hair_length": "Medium",
      "hair_style": "Straight",
      "height": "Medium",
      "skin_texture": "Smooth",
      "features": [
        "pointed ears"
      ],
      "description": "Pale with frost freckles smooth skin and ice-blue eyes frame his face; medium straight silver hair. He has medium, straight, silver hair — ice-blue eyes — pale with frost freckles, smooth skin — medium height, slim build. He has pointed ears. He is composed, purposeful, sharp when it counts. Chandler who crafts candles of whale-fat and mountain herbs. He sells light with superstition: some burn steady, others bend shadows if asked nicely. She wears fur-lined coats, frost-woven wraps, high boots, glacier-gleam brooch. He wears mirror-bright steel plate with leaf-engraved pauldrons, chain underlayers and a scarlet tabard—weighty and martial."
    },
    {
      "id": "NP00003028",
      "name": "Brigda Saltbrew",
      "race": "Coastal Dwarf",
      "sex": "Female",
      "type": "citizen",
      "eye_color": "Sea-green",
      "hair_color": "Salt-and-copper",
      "build": "Bulky",
      "skin_tone": "Wind-browned",
      "hair_length": "Medium",
      "hair_style": "Braided",
      "height": "Medium",
      "skin_texture": "Rough",
      "features": [],
      "description": "She is witty, charming, quick on the turn. Wind-browned rough skin and sea-green eyes frame her face; medium braided salt-and-copper hair. Brewer with a laugh as loud as gulls — her mead tastes faintly of brine and citrus. She keeps shells in her braids and storms in her barrels. She has . She wears tarred twine vest, sea-cloak, shell-braided beard, deck boots. She wears simple pilgrim’s wraps and sandals, walking staff banded in tin instead of a warhammer."
    },
    {
      "id": "NP00003029",
      "name": "Tovik Nailbite",
      "race": "Goblin",
      "sex": "Male",
      "type": "citizen",
      "eye_color": "Yellow",
      "hair_color": "Patchy black",
      "build": "Wirery",
      "skin_tone": "Sallow green",
      "hair_length": "Medium",
      "hair_style": "Straight",
      "height": "Medium",
      "skin_texture": "Smooth",
      "features": [],
      "description": "With medium straight patchy black hair and yellow eyes and sallow green smooth skin, he stands at medium height with wirery build. He has medium, straight, patchy black hair; yellow eyes; sallow green, smooth skin; medium height, wirery build. He is composed, purposeful, sharp when it counts. Locksmith whose grin shows more gaps than teeth. He chews nails—actual nails—when nervous. Goblin craft: lockpicks made from bone and humor. He has . She wears layered travel-wear, weathered cloak, belt pouches, sturdy boots. He wears linen shirt and waistcoat under a stormcloak, high boots and a brace of knives at the small of the back."
    },
    {
      "id": "NP00003030",
      "name": "Eira Stonebloom",
      "race": "Goliath",
      "sex": "Female",
      "type": "citizen",
      "eye_color": "Grey",
      "hair_color": "Black braid",
      "build": "Tall and muscular",
      "skin_tone": "Stone-marked pale",
      "hair_length": "Medium",
      "hair_style": "Braided",
      "height": "Tall",
      "skin_texture": "Smooth",
      "features": [],
      "description": "Eira wears medium braided black braid hair with grey eyes; stone-marked pale smooth skin and tall height and a tall and muscular build complete the impression. Goliath heritage paints her skin in pale granite streaks; she calls her ‘unfinished prayers.’ medium, braided, black braid hair; grey eyes; stone-marked pale, smooth skin; tall height, tall and muscular build. She is composed, purposeful, sharp when it counts. Stonecarver with boulder-etched muscles and hands scarred by chisel slips. She has . She wears stone-dyed leathers, corded cloak, bone clasps, heavy sandals. She wears a doublet and riding breeches with knee boots, gloves tucked through the belt."
    },
    {
      "id": "NP00003031",
      "name": "Saren Whisperwillow",
      "race": "Sylvari",
      "sex": "Male",
      "type": "citizen",
      "eye_color": "Emerald",
      "hair_color": "Leafy green",
      "build": "Slim",
      "skin_tone": "Bark-brown",
      "hair_length": "Medium",
      "hair_style": "Straight",
      "height": "Medium",
      "skin_texture": "Smooth",
      "features": [],
      "description": "Saren has medium straight leafy green hair — bark-brown smooth skin — emerald eyes — medium height and a slim build. He has medium, straight, leafy green hair; emerald eyes; bark-brown, smooth skin; medium height, slim build. He is composed, purposeful, sharp when it counts. Storyteller whose voice rises like wind through leaves. His tales plant seeds—some grow into trust, others into trouble. He has . She wears layered travel-wear, weathered cloak, belt pouches, sturdy boots. He wears steel plate over mail with a faded tabard, leather gloves and a sword belt worn smooth."
    },
    {
      "id": "NP00003032",
      "name": "Alenna Goldbranch",
      "race": "Forest Elf",
      "sex": "Female",
      "type": "citizen",
      "eye_color": "Hazel",
      "hair_color": "Brown",
      "build": "Slim",
      "skin_tone": "Olive",
      "hair_length": "Medium",
      "hair_style": "Straight",
      "height": "Medium",
      "skin_texture": "Smooth",
      "features": [
        "pointed ears"
      ],
      "description": "She is witty, charming, quick on the turn. Medium straight brown hair, hazel eyes, olive smooth skin; she is medium height and a slim build. She has medium, straight, brown hair — hazel eyes — olive, smooth skin — medium height, slim build. She has pointed ears. Winemaker who stains her lips purple and her laughter deeper. She insists every bottle has a memory corked inside—some happy, some best left sealed. She wears quiet leathers, leaf-dyed cloak, soft boots, beadwork and feather charms. She wears layered green leathers over a linen tunic, a quiver high on the back, bracers etched with vinework."
    },
    {
      "id": "NP00003033",
      "name": "Korrin Brassbuckle",
      "race": "Hill Dwarf",
      "sex": "Male",
      "type": "citizen",
      "eye_color": "Brown",
      "hair_color": "Rust-red",
      "build": "Stout",
      "skin_tone": "Sun-browned",
      "hair_length": "Medium",
      "hair_style": "Braided",
      "height": "Medium",
      "skin_texture": "Rough",
      "features": [],
      "description": "Korrin wears medium braided rust-red hair with brown eyes; sun-browned rough skin and medium height and a stout build complete the impression. He is witty, charming, quick on the turn. Tavern-keeper with rust-red beard braided into his belt. Stout frame, booming voice, and ale strong enough to wake ancestors. Hill Dwarf cheer: every toast is half joke, half battle cry. He has . She wears embroidered work tunic, stout belt, canvas trousers, field boots. He wears ringmail under an oilcloth coat, thick leather gloves and iron-toed boots black with soot."
    },
    {
      "id": "NP00003034",
      "name": "Yrris Starfall",
      "race": "Viridian Tiefling",
      "sex": "Female",
      "type": "citizen",
      "eye_color": "Green",
      "hair_color": "Blonde",
      "build": "Curvy",
      "skin_tone": "Light Green",
      "hair_length": "Medium",
      "hair_style": "Straight",
      "height": "Tall",
      "skin_texture": "Smooth",
      "features": [
        "horns",
        "tail",
        "pointed ears"
      ],
      "description": "Yrris has light green smooth skin — medium straight blonde hair — tall height and a curvy build — green eyes. She has medium, straight, black hair; green eyes; olive with green hue, smooth skin; medium height, slim build. She has white light brown antler-like pointed horns, short fur-tipped tail matching skin color, pointed ears. Her heritage is obvious: light green or turquoise smooth skin, antler-like white or light-white light brown antler-like pointed horns, and a short fur-short fur-tipped tail matching skin color matching the skin tone. She is composed, purposeful, sharp when it counts. Astrologer who tattoos star-maps across her own arms. She wears a flowing embroidered robe and sleeveless overcloak, a vine belt with pouches, leaf-stitched bracers, a long skirt with slits and strapped sandals.. She whispers fortunes with ink-stained fingers. She wears flowing embroidered robe, sleeveless overcloak, vine belt with pouches, leaf-stitched bracers, long skirt with slits, strapped sandals. She wears a flowing embroidered robe and sleeveless overcloak, vine belt with pouches, leaf-stitched bracers and strapped sandals."
    },
    {
      "id": "NP00003035",
      "name": "Bram Oakhollow",
      "race": "Human",
      "sex": "Male",
      "type": "citizen",
      "eye_color": "Brown",
      "hair_color": "Grey",
      "build": "Burly",
      "skin_tone": "Weathered tan",
      "hair_length": "Short",
      "hair_style": "Straight",
      "height": "Medium",
      "skin_texture": "Smooth",
      "features": [],
      "description": "He is composed, purposeful, sharp when it counts. Bram wears short straight grey hair with brown eyes; weathered tan smooth skin and medium height and a burly build complete the impression. He has short, straight, grey hair — brown eyes — weathered tan, smooth skin — medium height, burly build. He treats every felled tree like a funeral, every hearth-stock like a christening. He has . She wears layered travel-wear, weathered cloak, belt pouches, sturdy boots. He wears a doublet and riding breeches with knee boots, gloves tucked through the belt."
    },
    {
      "id": "NP00003036",
      "name": "Nimri Featherveil",
      "race": "Avianfolk",
      "sex": "Female",
      "type": "citizen",
      "eye_color": "Silver",
      "hair_color": "Feathered crest",
      "build": "Slim",
      "skin_tone": "Pale",
      "hair_length": "Medium",
      "hair_style": "Straight",
      "height": "Medium",
      "skin_texture": "Smooth",
      "features": [
        "wings",
        "talons"
      ],
      "description": "She is composed, purposeful, sharp when it counts. Pale smooth skin and silver eyes frame her face; medium straight feathered crest hair. She has medium, straight, feathered crest hair — silver eyes — pale, smooth skin — medium height, slim build. Midwife who hums lullabies that echo like wings. She ties blessings on threadbare wings and never lets a first cry go unanswered. She has wings, talons. She wears feathered mantle, flight leathers, beadwork, talon guards. She wears padded jack with steel splints under a quilted surcoat, knotted scarf and fingerless gloves."
    },
    {
      "id": "NP00003037",
      "name": "Jorek Ironstem",
      "race": "Iron Dwarf",
      "sex": "Male",
      "type": "citizen",
      "eye_color": "Black",
      "hair_color": "Coal-grey",
      "build": "Bulky",
      "skin_tone": "Ruddy",
      "hair_length": "Medium",
      "hair_style": "Braided",
      "height": "Medium",
      "skin_texture": "Rough",
      "features": [],
      "description": "With medium braided coal-grey hair and black eyes and ruddy rough skin, he stands at medium height with bulky build. He has medium, braided, coal-grey hair; black eyes; ruddy, rough skin; medium height, bulky build. He wears stout mail over quilted gambeson with plate at shoulders and shins, a broad belt of hammered brass. He is composed, purposeful, sharp when it counts. Blacksmith who tempers steel with old hymns. His hammers ring like church bells; his anvils whisper the day’s gossip. He has . She wears forge leathers, iron-banded bracers, tool belt, hobnail boots."
    },
    {
      "id": "NP00003038",
      "name": "Sivra Moonpetal",
      "race": "Great Elf",
      "sex": "Female",
      "type": "citizen",
      "eye_color": "Blue",
      "hair_color": "Silver",
      "build": "Tall",
      "skin_tone": "Ivory",
      "hair_length": "Medium",
      "hair_style": "Straight",
      "height": "Tall",
      "skin_texture": "Smooth",
      "features": [
        "pointed ears"
      ],
      "description": "She is calm, observant, quietly determined. Of tall height and a tall build, she shows blue eyes, medium straight silver hair, ivory smooth skin. She has medium, straight, silver hair — blue eyes — ivory, smooth skin — tall height, tall build. She has pointed ears. Florist whose bouquets lean toward the dangerous: nightshade nestled with roses, wolfsbane with lilies. Tall, ivory-skinned, silver-haired, with robes soft as twilight. She wears high court robes with metallic trim, jeweled clasps, silk gloves, polished boots. She wears a flowing saffron robe belted with braided cord, soft doeskin shoes and a travel-cloak pinned with a moon-brooch."
    },
    {
      "id": "NP00003039",
      "name": "Grendel Quickfang",
      "race": "Goblin",
      "sex": "Male",
      "type": "citizen",
      "eye_color": "Orange",
      "hair_color": "Stringy black",
      "build": "Thin",
      "skin_tone": "Green",
      "hair_length": "Medium",
      "hair_style": "Straight",
      "height": "Medium",
      "skin_texture": "Smooth",
      "features": [],
      "description": "Green smooth skin and orange eyes frame his face; medium straight stringy black hair. He has medium, straight, stringy black hair — orange eyes — green, smooth skin — medium height, thin build. He is calm, observant, quietly determined. Ratcatcher who carries a sack that wriggles. Goblin practicality: he eats what he catches, laughs while others squirm, and whistles to keep vermin calm. He has . She wears layered travel-wear, weathered cloak, belt pouches, sturdy boots. He wears a travel-worn cloak over layered leathers, hood up and boots dusted from the road."
    },
    {
      "id": "NP00003040",
      "name": "Veyra Nullbrand",
      "race": "Darkblood Tiefling",
      "sex": "Female",
      "type": "citizen",
      "eye_color": "Grey",
      "hair_color": "Grey",
      "build": "Slim",
      "skin_tone": "Light Grey",
      "hair_length": "Medium",
      "hair_style": "Straight",
      "height": "Medium",
      "skin_texture": "Cracked",
      "features": [
        "horns",
        "tail",
        "pointed ears"
      ],
      "description": "All light grey cracked skin and grey eyes, she carries a slim build at medium height; medium straight grey hair. Her heritage is obvious: light grey cracked craggily skin, black very long jagged pointed horns, black very long twisted spiked tail with a spiked tip. A Darkblood Tiefling citizen who carries herself with distinction. She wears leather breastplate with a high collar under a hooded cloak, scale-stitched bracers, a utility belt and fitted trousers with thigh straps, armored boots.. She wears attire suited to her station and embody the presence of her bloodline. She wears black leather breastplate with a high collar, hooded cloak, scale-stitched bracers and fitted trousers with thigh straps."
    },
    {
      "id": "NP00003041",
      "name": "Zaira Nullbrand",
      "race": "Darkblood Tiefling",
      "sex": "Female",
      "type": "citizen",
      "eye_color": "Grey",
      "hair_color": "Black",
      "build": "Slim",
      "skin_tone": "Light Grey",
      "hair_length": "Medium",
      "hair_style": "Straight",
      "height": "Medium",
      "skin_texture": "Cracked",
      "features": [
        "horns",
        "tail",
        "pointed ears"
      ],
      "description": "She has grey eyes, light grey cracked skin, medium height and a slim build, medium straight black hair. Her heritage is obvious: light grey cracked craggily skin, black very long jagged pointed horns, black very long twisted spiked tail with a spiked tip. A Darkblood Tiefling citizen who carries herself with distinction. She wears leather breastplate with a high collar under a hooded cloak, scale-stitched bracers, a utility belt and fitted trousers with thigh straps, armored boots.. She wears attire suited to her station and embody the presence of her bloodline. She wears black leather breastplate with a high collar, hooded cloak, scale-stitched bracers and fitted trousers with thigh straps."
    },
    {
      "id": "NP00003042",
      "name": "Mav Blackspike",
      "race": "Hellbound Tiefling",
      "sex": "Female",
      "type": "citizen",
      "eye_color": "Ember",
      "hair_color": "Orange",
      "build": "Strong",
      "skin_tone": "Red",
      "hair_length": "Medium",
      "hair_style": "Straight",
      "height": "Tall",
      "skin_texture": "Rough",
      "features": [
        "horns",
        "tail",
        "pointed ears"
      ],
      "description": "She cuts a strong figure at tall height — medium straight orange hair, ember eyes, red rough skin. Her heritage is obvious: red or orange rough skin, thick long blunt grey or light-grey light brown thick long blunt pointed horns, red medium thick tail the same color as the skin. She wears plated laminar with soot-black surcoat, gorget and braced vambraces, a scorched cloak at the shoulders. A Hellbound Tiefling citizen who carries herself with distinction. She wears heavy plate with spiked pauldrons and thick gauntlets, a chain belt over armored skirt panels, greaves and sabatons, a scorched cloak.. She wears attire suited to her station and embody the presence of her bloodline."
    },
    {
      "id": "NP00003043",
      "name": "Nyx Voidweave",
      "race": "Hellbound Tiefling",
      "sex": "Female",
      "type": "citizen",
      "eye_color": "Golden",
      "hair_color": "Red",
      "build": "Strong",
      "skin_tone": "Orange",
      "hair_length": "Medium",
      "hair_style": "Straight",
      "height": "Tall",
      "skin_texture": "Rough",
      "features": [
        "horns",
        "tail",
        "pointed ears"
      ],
      "description": "With medium straight red hair and golden eyes and orange rough skin, she stands at tall height with strong build. Her heritage is obvious: red or orange rough skin, thick long blunt grey or light-grey light brown thick long blunt pointed horns, red medium thick tail the same color as the skin. A Hellbound Tiefling citizen who carries herself with distinction. She wears heavy plate with spiked pauldrons and thick gauntlets, a chain belt over armored skirt panels, greaves and sabatons, a scorched cloak.. She wears attire suited to her station and embody the presence of her bloodline. She wears heavy plate with spiked pauldrons, thick gauntlets and a chain belt over armored skirt panels, greaves and sabatons."
    },
    {
      "id": "NP00003044",
      "name": "Vel Coalbrand",
      "race": "Voided Tiefling",
      "sex": "Female",
      "type": "citizen",
      "eye_color": "Brown",
      "hair_color": "White",
      "build": "Slim",
      "skin_tone": "Pitch Black",
      "hair_length": "Medium",
      "hair_style": "Straight",
      "height": "Tall",
      "skin_texture": "Smooth",
      "features": [
        "horns",
        "tail",
        "pointed ears"
      ],
      "description": "With medium straight white hair and brown eyes and pitch black smooth skin, she stands at tall height with slim build. Her heritage is obvious: pitch-black smooth skin, black long straight smooth upward pointed horns set upward, very long pointed very long pointed ears, pitch black long smooth tail. A Voided Tiefling citizen who carries herself with distinction. She wears a high-collar robe and sleeveless outer cloak, a long sash belt with hanging charms, silver-stitched gloves, fitted trousers and heeled boots, a cloak patterned like stars.. She wears attire suited to her station and embody the presence of her bloodline. She wears obsidian-toned garments with a star-patterned cloak, fitted trousers and long gloves."
    },
    {
      "id": "NP00003045",
      "name": "Selia Gloomline",
      "race": "Voided Tiefling",
      "sex": "Female",
      "type": "citizen",
      "eye_color": "Brown",
      "hair_color": "White",
      "build": "Slim",
      "skin_tone": "Pitch Black",
      "hair_length": "Medium",
      "hair_style": "Straight",
      "height": "Tall",
      "skin_texture": "Smooth",
      "features": [
        "horns",
        "tail",
        "pointed ears"
      ],
      "description": "Medium straight white hair, brown eyes, pitch black smooth skin; she is tall height and a slim build. Her heritage is obvious: pitch-black smooth skin, black long straight smooth upward pointed horns set upward, very long pointed very long pointed ears, pitch black long smooth tail. A Voided Tiefling citizen who carries herself with distinction. She wears a high-collar robe and sleeveless outer cloak, a long sash belt with hanging charms, silver-stitched gloves, fitted trousers and heeled boots, a cloak patterned like stars.. She wears attire suited to her station and embody the presence of her bloodline. She wears obsidian-toned garments with a star-patterned cloak, fitted trousers and long gloves."
    },
    {
      "id": "NP00003046",
      "name": "Sable Nightglass",
      "race": "Sableheart Tiefling",
      "sex": "Female",
      "type": "citizen",
      "eye_color": "Purple",
      "hair_color": "Pink",
      "build": "Curvy",
      "skin_tone": "Light Blue",
      "hair_length": "Medium",
      "hair_style": "Straight",
      "height": "Medium",
      "skin_texture": "Smooth",
      "features": [
        "horns",
        "tail",
        "pointed ears"
      ],
      "description": "She has medium straight pink hair — light blue smooth skin — purple eyes — medium height and a curvy build. Her heritage is obvious: light purple or light blue glossy skin, polished gold silver bronze long curved pointed horns, long tail matching skin color matching the skin tone. A Sableheart Tiefling citizen who carries herself with distinction. She wears a laced corset bodice and a layered skirt with a high slit, long silk gloves, a bolero jacket with long sleeves, strapped heeled boots and jewelry chains.. She wears attire suited to her station and embody the presence of her bloodline. She wears a fitted satin dress with metallic piping and opera-length gloves, anklets chiming softly."
    },
    {
      "id": "NP00003047",
      "name": "Zaya Starflax",
      "race": "Sableheart Tiefling",
      "sex": "Female",
      "type": "citizen",
      "eye_color": "Purple",
      "hair_color": "Purple",
      "build": "Curvy",
      "skin_tone": "Light Blue",
      "hair_length": "Medium",
      "hair_style": "Straight",
      "height": "Medium",
      "skin_texture": "Smooth",
      "features": [
        "horns",
        "tail",
        "pointed ears"
      ],
      "description": "With medium straight purple hair and purple eyes and light blue smooth skin, she stands at medium height with curvy build. Her heritage is obvious: light purple or light blue glossy skin, polished gold silver bronze long curved pointed horns, long tail matching skin color matching the skin tone. A Sableheart Tiefling citizen who carries herself with distinction. She wears a laced corset bodice and a layered skirt with a high slit, long silk gloves, a bolero jacket with long sleeves, strapped heeled boots and jewelry chains.. She wears attire suited to her station and embody the presence of her bloodline. She wears a laced corset bodice and layered skirt with a high slit, long silk gloves, a bolero jacket and strapped heeled boots with jewelry chains."
    },
    {
      "id": "NP00003048",
      "name": "Nyx Gloomline",
      "race": "Viridian Tiefling",
      "sex": "Female",
      "type": "citizen",
      "eye_color": "Green",
      "hair_color": "Blonde",
      "build": "Curvy",
      "skin_tone": "Light Green",
      "hair_length": "Medium",
      "hair_style": "Straight",
      "height": "Tall",
      "skin_texture": "Smooth",
      "features": [
        "horns",
        "tail",
        "pointed ears"
      ],
      "description": "She is of tall height and a curvy build — medium straight blonde hair · green eyes · light green smooth skin. Her heritage is obvious: light green or turquoise smooth skin, antler-like white or light-white light brown antler-like pointed horns, and a short fur-short fur-tipped tail matching skin color matching the skin tone. A Viridian Tiefling citizen who carries herself with distinction. She wears a flowing embroidered robe and sleeveless overcloak, a vine belt with pouches, leaf-stitched bracers, a long skirt with slits and strapped sandals.. She wears attire suited to her station and embody the presence of her bloodline. She wears a woodcutter’s kit—tough canvas jacket, rolled sleeves, bramble-snagged trousers and stout boots."
    },
    {
      "id": "NP00003049",
      "name": "Mav Ashmire",
      "race": "Viridian Tiefling",
      "sex": "Female",
      "type": "citizen",
      "eye_color": "Green",
      "hair_color": "Brown",
      "build": "Curvy",
      "skin_tone": "Turquoise",
      "hair_length": "Medium",
      "hair_style": "Straight",
      "height": "Tall",
      "skin_texture": "Smooth",
      "features": [
        "horns",
        "tail",
        "pointed ears"
      ],
      "description": "Of tall height and a curvy build, she shows green eyes, medium straight brown hair, turquoise smooth skin. Her heritage is obvious: light green or turquoise smooth skin, antler-like white or light-white light brown antler-like pointed horns, and a short fur-short fur-tipped tail matching skin color matching the skin tone. A Viridian Tiefling citizen who carries herself with distinction. She wears a flowing embroidered robe and sleeveless overcloak, a vine belt with pouches, leaf-stitched bracers, a long skirt with slits and strapped sandals.. She wears attire suited to her station and embody the presence of her bloodline. She wears a woodcutter’s kit—tough canvas jacket, rolled sleeves, bramble-snagged trousers and stout boots."
    }
  ]
}